paper_id,title,author,abstract,affiliation,address,category
237,Virtual Radios,"Vanu Bose, Mike Ismert, Matt Welborn, John Guttag","Abstract Conventional software radios take advantage of vastly improved A/D converters and DSP hardware. Our approach, which we refer to as virtual radios, also depends upon high performance A/D converters. However, rather than use DSPs, we have chosen to ride the curve of rapidly improving workstation hardware. We use wideband digitization and then perform all of the digital signal processing in user space on a general purpose workstation. This approach allows us to experiment with new approaches to signal processing that exploit the hardware and software resources of the workstation. Furthermore, it allows us to experiment with different ways of structuring systems in which the radio component of communication devices are integrated with higher-level applications. This paper describes the design and performance of an environment we have constructed that facilitates building virtual radios and of two applications built using that environment. The environment consists of an I/O subsystem that provides high bandwidth low latency user-level access to digitized signals and a programming environment that provides an infrastructure for building applications. The applications, which exemplify some of the benefits of virtual radios, are a software cellular receiver and a novel wireless network interface.",Software Devices and Systems Group Laboratory for Computer Science Massachusetts Institute of Technology,,1
238,Myrinet - A Gigabit-per-Second Local-Area Network,"Nanette J. Boden, Danny Cohen, Robert E. Felderman, Alan E. Kulawik, Charles L. Seitz, Jakov N. Seizovic, and Wen-King Su","Abstract. Myrinet is a new type of local-area network (LAN) based on the technology used for packet communication and switching within ""massively-parallel processors"" (MPPs). Think of Myrinet as an MPP message-passing network that can span campus dimensions, rather than as a wide-area telecommunications network that is operating in close quarters. The technical steps toward making Myrinet a reality included the development of (1) robust, 25m communication channels with flow control, packet framing, and error control; (2) self-initializing, low-latency, cut-through switches; (3) host interfaces that can map the network, select routes, and translate from network addresses to routes, as well as handle packet traffic; and (4) streamlined host software that allows direct communication between user processes and the network.","Myricom, Inc.","325 N. Santa Anita Ave. Arcadia, CA 91006",3
239,Virtual Memory Architecture in SunOS,Robert A. Gingell Joseph P. Moran William A. Shannon,"ABSTRACT A new virtual memory architecture for the Sun implementation of the UNIX operating system is described. Our goals included unifying and simplifying the concepts the system used to manage memory, as well as providing an implementation that fit well with the rest of the system. We discuss an architecture suitable for environments that (potentially) consist of systems of heterogeneous hardware and software architectures. The result is a page-based system in which the fundamental notion is that of mapping process addresses to files.","Sun Microsystems, Inc.","2550 Garcia Ave. Mountain View, CA 94043",5
240,A Survey of Collective Communication in Wormhole-Routed Massively Parallel Computers,"Philip K. McKinley, Yih-jia Tsai, and David F. Robinson",,,,0
241,Feature Correspondence by Interleaving Shape and Texture Computations,David Beymer,"Abstract The correspondence problem in computer vision is basically a matching task between two or more sets of features. In this paper, we introduce a vectorized image representation, which is a feature-based representation where correspondence has been established with respect to a reference image. The representation consists of two image measurements made at the feature points: shape and texture. Feature geometry, or shape, is represented using the (x; ) locations of features relative to the some standard reference shape. Image grey levels, or texture, are represented by mapping image grey levels onto the standard reference shape. Computing this representation is essentially a correspondence task, and in this paper we explore an automatic technique for ""vectorizing"" face images. Our face vectorizer alternates back and forth between computation steps for shape and texture, and a key idea is to structure the two computations so that each one uses the output of the other. In addition to describing the vectorizer, an application to the problem of facial feature detection will be presented.","Artificial Intelligence Laboratory, and Center for Biological and Computational Learning Massachusetts Institute of Technology","Cambridge, MA 02139, USA",4
242,Narrowing Interval Bounds,Joseph D. Darcy,"1. Abstract Interval arithmetic is an automated attempt to give guaranteed upper and lower bounds of a numerical computation in the face of uncertainly in the input data and floating point roundoff during the calculation. While a simple interval equivalent of a rational function can be readily synthesized, the bounds from this construction may be too pessimistically large to be useful. This paper surveys a variety of techniques for refining the interval bounds. An appendix identifies issues with realizing floating point based interval arithmetic on current IEEE 754 compliant processors.",,,5
243,A New O(n 2 ) Algorithm for the Symmetric Tridiagonal Eigenvalue/Eigenvector Problem,by Inderjit Singh Dhillon,,"UNIVERSITY of CALIFORNIA, BERKELEY",,0
244,Using Skeletons for Nonholonomic Path Planning among Obstacles,Brian Mirtich  John Canny,"Abstract This paper describes a practical path planner for nonholonomic robots in environments with obstacles. The planner is based on building a one-dimensional, maximal clearance skeleton through the configuration space of the robot. However rather than using the Eu-clidean metric to determine clearance, a special metric which captures information about the nonholonomy of the robot is used. The robot navigates from start to goal states by loosely following the skeleton; the resulting paths taken by the robot are of low ""complexity."" We describe how much of the computation can be done off-line once and for all for a given robot, making for an efficient planner. The focus is on path planning for mobile robots, particularly the planar two-axle car, but the underlying ideas are quite general and may be applied to planners for other nonholonomic robots.",Computer Science Division University of California,"Berkeley, CA 94720",4
245,Belief Revision: A Critique,Nir Friedman,"Abstract The problem of belief changehow an agent should revise her beliefs upon learning new informationhas been an active area of research in both philosophy and artificial intelligence. Many approaches to belief change have been proposed in the literature. Our goal is not to introduce yet another approach, but to examine carefully the rationale underlying the approaches already taken in the literature, and to highlight what we view as methodological problems in the literature. The main message is that to study belief change carefully, we must be quite explicit about the ontology or scenario underlying the belief change process. This is something that has been missing in previous work, with its focus on postulates. Our analysis shows that we must pay particular attention to two issues which have often been taken for granted: The first is how we model the agent's epistemic state. (Do we use a set of beliefs, or a richer structure, such as an ordering on worlds? And if we use a set of beliefs, in what language are these beliefs are expressed?) The second is the status of observations. (Are observations known to be true, or just believed? In the latter case, how firm is the belief?) For example, we argue that even postulates that have been called beyond controversy are unreasonable when the agent's beliefs include beliefs about her own epistemic state as well as the external world. Issues of the status of observations arise particularly when we consider iterated belief revision, and we must confront the possibility of revising by ' and then by :'.",Computer Science Department Stanford University,"Gates Building 1A Stanford, CA 94305-9010",2
246,A Fast Algorithm for Incremental Distance Calculation,Ming C. Lin and John F. Canny,"Abstract A simple and efficient algorithm for finding the closest points between two convex polyhedra is described here. Data from numerous experiments tested on a broad set of convex polyhedra on &lt; 3 show that the running time is roughly constant for finding closest points when nearest points are approximately known and is linear in total number of vertices if no special initialization is done. This algorithm can be used for collision detection, computation of the distance between two polyhedra in three-dimensional space, and other robotics problems. It forms the heart of the motion planning algorithm of [1].","University of California, Berkeley","Berkeley, CA 94720",4
247,High-Performance Sorting on Networks of Workstations,Andrea C. Arpaci-Dusseau,"Abstract We report the performance of NOW-Sort, a collection of sorting implementations on a Network of Workstations (NOW). We find that parallel sorting on a NOW is competitive to sorting on the large-scale SMPs that have traditionally held the performance records. On a 64-node cluster, we sort 6.0 GB in just under one minute, while a 32-node cluster finishes the Datamation benchmark in 2.41 seconds. Our implementations can be applied to a variety of disk, memory, and processor configurations; we highlight salient issues for tuning each component of the system. We evaluate the use of commodity operating systems and hardware for parallel sorting. We find existing OS primitives for memory management and file access adequate. Due to aggregate communication and disk bandwidth requirements, the bottleneck of our system is the workstation I/O bus.","Computer Science Division University of California, Berkeley",,2
248,The Interaction of Parallel and Sequential Workloads on a Network of Workstations,"Remzi H. Arpaci, Andrea C. Dusseau, Amin M. Vahdat, Lok T. Liu, Thomas E. Anderson, and David A. Patterson","Abstract This paper examines the plausibility of using a network of workstations (NOW) for a mixture of parallel and sequential jobs. Through simulations, our study examines issues that arise when combining these two workloads on a single platform. Starting from a dedicated NOW just for parallel programs, we incrementally relax uniprogramming restrictions until we have a multi-programmed, multi-user NOW for both interactive sequential users and parallel programs. We show that a number of issues associated with the distributed NOW environment (e.g., daemon activity, coscheduling skew) can have a small but noticeable effect on parallel program performance. We also find that efficient migration to idle workstations is necessary to maintain acceptable parallel application performance. Furthermore, we present a methodology for deriving an optimal delay time for recruiting idle machines for use by parallel programs; this recruitment threshold was just 3 minutes for the research cluster we measured. Finally, we quantify the effects of the additional parallel load upon interactive users by keeping track of the potential number of user delays in our simulations. When we limit the maximum number of delays per user, we can still maintain acceptable parallel program performance. In summary, we find that for our workloads a 2:1 rule applies: a NOW cluster of approximately 60 machines can sustain a 32-node parallel workload in addition to the sequential load placed upon it by interactive users.","Computer Science Division University of California, Berkeley","Berkeley, CA 94720",4
249,"""Go With the Winners"" Algorithms",David Aldous,,Department of Statistics University of California,Berkeley CA 94720,4
250,Stochastic Interaction and Linear Logic,Patrick D. Lincoln John C. Mitchell Andre Scedrov x,"Abstract We present stochastic interactive semantics for propositional linear logic without modalities. The framework is based on interactive protocols considered in computational complexity theory, in which a prover with unlimited power interacts with a verifier that can only toss fair coins or perform simple tasks when presented with the given formula or with subsequent messages from the prover. The additive conjunction & is described as random choice, which reflects the intuitive idea that the verifier can perform only ""random spot checks"". This stochastic interactive semantic framework is shown to be sound and complete. Furthermore, the prover's winning strategies are basically proofs of the given formula. In this framework the multiplicative and additive connectives of linear logic are described by means of probabilistic operators, giving a new basis for intuitive reasoning about linear logic and a potential new tool in automated deduction.","SRI International Computer Science Laboratory,",Menlo Park CA 94025 USA.,5
251,Form(ers) Over Function(s): The KOLA Reference Manual,Mitch Cherniack,"0.1 Still To Do * 6 more fold proofs, precondition proofs * Adjust primitives for Int, Str and Char to be synchronized with the Theta operators for these types * Add floats * Add section describing preconditions * Add section on semantic optimizations, nested query optimization * Fix awk script to generate Latex version of Larch scripts without typeface glitches",,,1
252,The AQUA Approach to Querying Lists and Trees in Object-Oriented Databases,Bharathi Subramanian Theodore W. Leung,"Abstract Relational database systems and most object-oriented database systems provide support for queries. Usually these queries represent retrievals over sets or multisets. Many new applications for databases, such as multimedia systems and digital libraries, need support for queries on complex bulk types such as lists and trees. In this paper we describe an object-oriented query algebra for lists and trees. The operators in the algebra preserve the ordering between the elements of a list or tree, even when the result list or tree contains an arbitrary set of nodes from the original tree. We also present predicate languages for lists and trees which allow order-sensitive queries because they use pattern matching to examine groups of list or tree nodes rather than individual nodes. The ability to decompose predicate patterns enables optimizations that make use of indices.",Brown University Brown University,,3
253,LOCALIZED TEMPORAL REASONING USING SUBGOALS AND ABSTRACT EVENTS,"Shieu-Hong Lin, Thomas Dean 1","We are concerned with temporal reasoning problems where there is uncertainty about the order in which events occur. The task of temporal reasoning is to derive an event sequence consistent with a given set of ordering constraints to achieve a goal. Previous research shows that the associated decision problems are hard even for very restricted cases. In this paper, we investigate locality in event ordering and causal dependencies. We present a localized temporal reasoning algorithm that uses subgoals and abstract events to exploit locality. The computational efficiency of our algorithm for a problem instance is quantified by the inherent locality in the instance. We theoretically demonstrate the substantial improvement in performance gained by exploiting locality. This work provides a solid evidence of the usefulness of localized reasoning in exploiting locality.","Department of Computer Science, Brown University,","Providence, RI 02912",5
254,How good are genetic algorithms at finding large cliques: an experimental study,Bob Carter,"Abstract This paper investigates the power of genetic algorithms at solving the MAX-CLIQUE problem. We measure the performance of a standard genetic algorithm on an elementary set of problem instances consisting of embedded cliques in random graphs. We indicate the need for improvement, and introduce a new genetic algorithm, the multi-phase annealed GA, which exhibits superior performance on the same problem set. As we scale up the problem size and test on ""hard"" benchmark instances, we notice a degraded performance in the algorithm caused by premature convergence to local minima. To alleviate this problem, a sequence of modifications are implemented ranging from changes in input representation to systematic local search. The most recent version, called union GA, incorporates the features of union cross-over, greedy replacement, and diversity enhancement. It shows a marked speed-up in the number of iterations required to find a given solution, as well as some improvement in the clique size found. We discuss issues related to the SIMD implementation of the genetic algorithms on a Thinking Machines CM-5, which was necessitated by the intrinsically high time complexity (O(n 3 )) of the serial algorithm for computing one iteration. Our preliminary conclusions are: (1) a genetic algorithm needs to be heavily customized to work ""well"" for the clique problem; (2) a GA is computationally very expensive, and its use is only recommended if it is known to find larger cliques than other algorithms; (3) although our customization effort is bringing forth continued improvements, there is no clear evidence, at this time, that a GA will have better success in circumventing local minima.",Boston University Computer Science Department,"Boston, MA 02215",3
255,Implementation and Performance Evaluation of TCP Boston A Fragmentation-tolerant TCP Protocol for ATM Networks,Azer Bestavros,"ABSTRACT: In this paper, we overview the implementation of TCP Boston a novel fragmentation-tolerant transport protocol, especially suited for ATM's 53-byte cell-oriented switching architecture. TCP Boston integrates a standard TCP/IP protocol, such as Reno or Vegas, with a powerful redundancy control mechanism based on AIDAan adaptive version of Rabin's IDA dispersal and reconstruction algorithms. Our results show that TCP Boston improves TCP/IP's performance over ATMs for both network-centric metrics (e.g., effective throughput) and application-centric metrics (e.g., response time).",Computer Science Department Boston University,"Boston, MA 02215",4
256,Generating CAD-models of teeth,Peter Johannes Neugebauer,"In this paper, we present an approach for the reconstruction of teeth model. Therefore, a tooth model has to be scanned from several directions with a 3D-laser scanner. Several views are necessary because of shadows and occluded areas in the range images. Then, all acquired range views are combined to build a CAD-model of the tooth. The idea is that every part of the surface should be visible in at least one view. The reconstruction process is divided into the steps registration, volume sculpturing and generation of an accurate polygonal representation.","Fraunhofer-Institute for Computer Graphics,","Wilhelminenstrasse 7, 64283 Darmstadt, Germany,",6
257,Bias-Driven Revision of Logical Domain Theories,Moshe Koppel,"Abstract The theory revision problem is the problem of how best to go about revising a deficient domain theory using information contained in examples that expose inaccuracies. In this paper we present our approach to the theory revision problem for propositional domain theories. The approach described here, called PTR, uses probabilities associated with domain theory elements to numerically track the ``ow'' of proof through the theory. This allows us to measure the precise role of a clause or literal in allowing or preventing a (desired or undesired) derivation for a given example. This information is used to efficiently locate and repair awed elements of the theory. PTR is proved to converge to a theory which correctly classifies all examples, and shown experimentally to be fast and accurate even for deep theories.","Department of Mathematics and Computer Science, Bar-Ilan University,","Ramat-Gan, Israel",0
258,A Middleware Service for Real-Time Push-Pull Communications,Kanaka Juvva and Raj Rajkumar,"Abstract: Current and emerging real-time and multimedia applications like multi-party collaboration, internet telephony and distributed command control systems require the exchange of information over distributed and heterogeneous nodes. Multiple data types including voice, video, sensor data, real-time intelligence data and text are being transported widely across today's information, control and surveillance networks. All such applications can benefit enormously from middleware, operating system and networking services that can support QoS guarantees, high availability, dynamic reconfigurability and scalability. In this paper, we propose a middleware layer called a ""Real-Time Push-Pull Communications Service"" to easily and quickly disseminate information across heterogeneous nodes with an underlying architecture to satisfy the above-mentioned requirements. Push-Pull Communications is an extension of the real-time publisher/subscriber model [4], and represents both ""push"" (data transfer initiated by a sender) and ""pull"" (data transfer initiated by a receiver) communications. Nodes with widely differing processing power and networking bandwidth can coordinate and co-exist by the provision of appropriate and automatic support for transformation on data and supports scaling. Different information sources and sinks can operate at different frequencies and also can choose another (intermedi-ate) node to act as their proxy and and deliver data at the desired frequency. This service has been implemented on RT-Mach, a resource-centric kernel using resource kernel primitives [7]. This paper presents an overview of the design, implementation and preliminary performance evaluation of the model.",Real-Time and Multimedia Laboratory Carnegie Mellon University,Pittsburgh PA 15213,0
259,Building and Refining Abstract Planning Cases by Change of Representation Language,Ralph Bergmann,"Abstract Abstraction is one of the most promising approaches to improve the performance of problem solvers. In several domains abstraction by dropping sentences of a domain description as used in most hierarchical planners has proven useful. In this paper we present examples which illustrate significant drawbacks of abstraction by dropping sentences. To overcome these drawbacks, we propose a more general view of abstraction involving the change of representation language. We have developed a new abstraction methodology and a related sound and complete learning algorithm that allows the complete change of representation language of planning cases from concrete to abstract. However, to achieve a powerful change of the representation language, the abstract language itself as well as rules which describe admissible ways of abstracting states must be provided in the domain model. This new abstraction approach is the core of Paris (Plan Abstraction and Refinement in an Integrated System), a system in which abstract planning cases are automatically learned from given concrete cases. An empirical study in the domain of process planning in mechanical engineering shows significant advantages of the proposed reasoning from abstract cases over classical hierarchical planning.","Centre for Learning Systems and Applications (LSA) University of Kaiserslautern,","P.O.-Box 3049, D-67653 Kaiserslautern, Germany",4
260,Automation Tools for NonDestructive Inspection of Aircraft: Promise of Technology Transfer from the Civilian to the Military Sector,"Chris Seher 1 , Mel Siegel 2 , and William M. Kaufman 3","Abstract The FAA Aging Aircraft Research Program is supporting the development of a robotic mobile nondestructive inspection (NDI) instrument deployment tool at Carnegie Mellon University (CMU) with the active participation of USAir. The program has spawned several new relationships and entities: an alliance with an ARPA-funded research program at CMU having the capability to add 3D-stereoscopic enhanced visual inspection capability, a start-up company organized to commercialize the combined technologies, and State of Pennsylvania funding to foster this commercialization. As a result of these activities and connections the civilian sector appears to be ahead of the military sector in important aspects of automation for deployment of aircraft inspection equipment. A partnership between the university researchers, the airline operator, the start-up company, and the state government is thus emerging as the likely agent for transfer of the civilian-developed technology to the military sector.","1 Federal Aviation Administration, Technical Center,",Atlantic City NJ 08201,5
261,The Candide System for Machine Translation,"Adam L. Berger, Peter F. Brown , Stephen A. Della Pietra, Vincent J. Della Pietra, John R. Gillett, John D. Lafferty, Robert L. Mercer, Harry Printz, Lubos Ures","ABSTRACT We present an overview of Candide, a system for automatic translation of French text to English text. Candide uses methods of information theory and statistics to develop a probability model of the translation process. This model, which is made to accord as closely as possible with a large body of French and English sentence pairs, is then used to generate English translations of previously unseen French sentences. This paper provides a tutorial in these methods, discussions of the training and operation of the system, and a summary of test results.",IBM Thomas J. Watson Research Center,"P.O. Box 704 Yorktown Heights, NY 10598",2
