paper_id,title,author,abstract,affiliation,address,category
365,ON UNAPPROXIMABLE VERSIONS OF NP-COMPLETE PROBLEMS,DAVID ZUCKERMAN,"Abstract. We prove that all of Karp's 21 original NP -complete problems have a version that's hard to approximate. These versions are obtained from the original problems by adding essentially the same, simple constraint. We further show that these problems are absurdly hard to approximate. In fact, no polynomial-time algorithm can even approximate log (k) of the magnitude of these problems to within any constant factor, where log (k) denotes the logarithm iterated k times, unless N P is recognized by slightly superpolynomial randomized machines. We use the same technique to improve the constant * such that MAX CLIQUE is hard to approximate to within a factor of n * . Finally, we show that it is even harder to approximate two counting problems: counting the number of satisfying assignments to a monotone 2-SAT formula and computing the permanent of -1,0,1 matrices.",,,2
366,Frangipani: A Scalable Distributed File System,Chandramohan A. Thekkath Timothy Mann Edward K. Lee,"Abstract The ideal distributed file system would provide all its users with coherent, shared access to the same set of files,yet would be arbitrarily scalable to provide more storage space and higher performance to a growing user community. It would be highly available in spite of component failures. It would require minimal human administration, and administration would not become more complex as more components were added. Frangipani is a new file system that approximates this ideal, yet was relatively easy to build because of its two-layer structure. The lower layer is Petal (described in an earlier paper), a distributed storage service that provides incrementally scalable, highly available, automatically managed virtual disks. In the upper layer, multiple machines run the same Frangipani file system code on top of a shared Petal virtual disk, using a distributed lock service to ensure coherence. Frangipani is meant to run in a cluster of machines that are under a common administration and can communicate securely. Thus the machines trust one another and the shared virtual disk approach is practical. Of course, a Frangipani file system can be exported to untrusted machines using ordinary network file access protocols. We have implemented Frangipani on a collection of Alphas running DIGITAL Unix 4.0. Initial measurements indicate that Frangipani has excellent single-server performance and scales well as servers are added.",Systems Research Center Digital Equipment Corporation,"130 Lytton Ave, Palo Alto, CA 94301",2
367,Constructing Scripts from Components: Working Note 6,Peter Clark and Bruce Porter,,"Dept. CS, UT Austin",,6
368,Broadcasting on Meshes with Worm-Hole Routing,Michael Barnett,"Abstract We address the problem of broadcasting on mesh architectures with arbitrary (non-power-two) dimensions. It is assumed that such mesh architectures employ cut-through or worm-hole routing. The primary focus is on avoiding network conflicts in the various proposed algorithms. We give algorithms for performing a conflict-free minimum-spanning tree broadcast, a pipelined algorithm that is similar to Ho and Johnsson's EDST algorithm for hypercubes, and a novel scatter-collect approach that is a natural choice for communication libraries due to its simplicity. Results obtained on the Intel Paragon system are included.",Department of Computer Science University of Idaho,"Moscow, Idaho 83844-1010",2
369,Anatomy of a Parallel Out-of-Core Dense Linear Solver,Kenneth Klimkowski,"Abstract In this paper, we describe the design and implementation of the Platform Independent Parallel Solver (PIPSolver) package for the out-of-core (OOC) solution of complex dense linear systems. Our approach is unique in that it allows essentially all of RAM to be filled with the current portion of the matrix (slab) to be updated and factored, thereby greatly improving the computation to I/O ratio over previous approaches. Experiences and performance are reported for the Cray T3D system.",Texas Institute for Computational and Applied Mathematics The University of Texas at Austin,"Austin, Texas 78712",4
370,NetSolve: A Network Server for Solving Computational Science Problems,Henri Casanova,"Abstract This paper presents a new system, called NetSolve, that allows users to access computational resources, such as hardware and software, distributed across the network. The development of NetSolve was motivated by the need for an easy-to-use, efficient mechanism for using computational resources remotely. Ease of use is obtained as a result of different interfaces, some of which require no programming effort from the user. Good performance is ensured by a load-balancing policy that enables NetSolve to use the computational resources available as efficiently as possible. NetSolve offers the ability to look for computational resources on a network, choose the best one available, solve a problem (with retry for fault-tolerance), and return the answer to the user.","University of Tennessee UTK, Dept. of Computer Science","104, Ayres Hall. KNOXVILLE, TN 37996-1301.",4
371,An Ordering on Subgoals for Planning,Fangzhen Lin,Abstract Subgoal ordering is a type of control information that has received much attention in AI planning community. In this paper we formulate precisely a subgoal ordering in the situation calculus. We show how information about this subgoal ordering can be deduced from the background action theory. We also show for both linear and nonlinear planners how knowledge about this ordering can be used in a provably correct way to avoid unnecessary backtracking.,epartment of Computer Science The Hong Kong University of Science and Technology,"Clear Water Bay, Kowloon, Hong Kong",5
372,Specifying Instructions' Semantics Using CSDL (Preliminary Report),Norman Ramsey and Jack W. Davidson,,Department of Computer Science University of Virginia,"Charlottesville, VA 22903",5
373,A Distributed Protocol for Channel-Based Communication with Choice,Frederick Knabe,"Abstract Recent attempts at incorporating concurrency into functional languages have identified synchronous communication via shared channels as a promising primitive. An additional useful feature found in many proposals is a nondeterministic choice operator. Similar in nature to the CSP alternative command, this operator allows different possible actions to be guarded by sends or receives. Choice is difficult to implement in a distributed environment because it requires offering many potential communications but closing only one. In this paper we present the first distributed, deadlock-free algorithm for choice.",European Computer-Industry Research Centre GmbH,"Munich, Germany",1
374,Non-Tree Routing,Bernard A. McCoy and Gabriel Robins,"Abstract An implicit premise of existing routing methods is that the routing topology must correspond to a tree (i.e., it does not contain cycles). In this paper we investigate the consequences of abandoning this basic axiom, and instead we allow routing topologies that correspond to arbitrary graphs (i.e., where cycles are allowed). We show that non-tree routing can significantly improve signal propagation delay, reduce signal skew, and afford increased reliability with respect to open faults that may be caused by manufacturing defects and electro-migration. Simulations on uniformly-distributed nets indicate that depending on net size and technology parameters, our non-tree routing construction reduces maximum sourse-sink SPICE delay by an average of up to 62%, and reduces signal skew by an average of up to 63%, as compared with Steiner routing. Moreover, up to 77% of the total wirelength in non-trees can tolerate an open fault without disconnecting the circuit.","Department of Computer Science, University of Virginia,","Charlottesville, VA 22903-2442",0
375,Using Runtime Measured Workload Characteristics in Parallel Processor Scheduling,"Thu D. Nguyen, Raj Vaswani, and John Zahorjan",,"Department of Computer Science and Engineering,",Box 352350,3
376,PCp 3 : A C Front End for Preprocessor Analysis and Transformation,Greg J. Badros,"Abstract Though the C preprocessor provides necessary language features, it does so in an unstructured way. The lexical nature of cpp creates numerous problems for software engineers and their tools, all stemming from the chasm between the engineer's view of the source code and the compiler's view. The simplest way to reduce this problem is to minimize use of the preprocessor. In light of the data collected in a prior empirical analysis, this paper describes a tool to aid the software engineer in analyses targeted at replacing preprocessor constructs with language features. Existing tools for analyzing C source in the context of the preprocessor are unsuitable for such transformations. This work introduces a new approach: tightly integrating the preprocessor with a C language parser, permitting the code to be analyzed at both the preprocessor and syntactic levels simultaneously. The front-end framework, called PCp 3 , combines a preprocessor, a parser, and arbitrary Perl subroutine ""hooks"" invoked upon various preprocessor and parser events. PCp 3 's strengths and weaknesses are discussed in the context of several program understanding and transformation tools, including a conservative analysis to support replacing cpp's #define directives with C++ language features.",,,4
377,Effective Cache Prefetching on Bus-Based Multiprocessors,Dean M. Tullsen and Susan J. Eggers,"Abstract Compiler-directed cache prefetching has the potential to hide much of the high memory latency seen by current and future high-performance processors. However, prefetching is not without costs, particularly on a multiprocessor. Prefetching can negatively affect bus utilization, overall cache miss rates, memory latencies and data sharing. We simulate the effects of a compiler-directed prefetching algorithm, running on a range of bus-based multiprocessors. We show that, despite a high memory latency, this architecture does not necessarily support prefetching well, in some cases actually causing performance degradations. We pinpoint several problems with prefetching on a shared memory architecture (additional conflict misses, no reduction in the data sharing traffic and associated latencies, a multiprocessor's greater sensitivity to memory utilization and the sensitivity of the cache hit rate to prefetch distance) and measure their effect on performance. We then solve those problems through architectural techniques and heuristics for prefetching that could be easily incorporated into a compiler: 1) victim caching, which eliminates most of the cache conflict misses caused by prefetching in a direct-mapped cache, 2) special prefetch algorithms for shared data, which significantly improve the ability of our basic prefetching algorithm to prefetch invalidation misses, and 3) compiler-based shared data restructuring, which eliminates many of the invalidation misses the basic prefetching algorithm doesn't predict. The combined effect of these improvements is to make prefetching effective over a much wider range of memory architectures.",University of Washington,,2
378,Model-Based Diagnosis using Structured System Descriptions,Adnan Darwiche,"Abstract This paper presents a comprehensive approach for model-based diagnosis which includes proposals for characterizing and computing preferred diagnoses, assuming that the system description is augmented with a system structure (a directed graph explicating the interconnections between system components). Specifically, we first introduce the notion of a consequence, which is a syntactically unconstrained propositional sentence that characterizes all consistency-based diagnoses and show that standard characterizations of diagnoses, such as minimal conflicts, correspond to syntactic variations on a consequence. Second, we propose a new syntactic variation on the consequence known as negation normal form (NNF) and discuss its merits compared to standard variations. Third, we introduce a basic algorithm for computing consequences in NNF given a structured system description. We show that if the system structure does not contain cycles, then there is always a linear-size consequence in NNF which can be computed in linear time. For arbitrary system structures, we show a precise connection between the complexity of computing consequences and the topology of the underlying system structure. Finally, we present an algorithm that enumerates the preferred diagnoses characterized by a consequence. The algorithm is shown to take linear time in the size of the consequence if the preference criterion satisfies some general conditions.",Department of Mathematics American University of Beirut,"PO Box 11-236 Beirut, Lebanon",4
379,Partition Based Spatial-Merge Join,Jignesh M. Patel David J. DeWitt,"Abstract This paper describes PBSM (Partition Based Spatial-Merge), a new algorithm for performing spatial join operation. This algorithm is especially effective when neither of the inputs to the join have an index on the joining attribute. Such a situation could arise if both inputs to the join are intermediate results in a complex query, or in a parallel environment where the inputs must be dynamically redistributed. The PBSM algorithm partitions the inputs into manageable chunks, and joins them using a computational geometry based plane-sweeping technique. This paper also presents a performance study comparing the the traditional indexed nested loops join algorithm, a spatial join algorithm based on joining spatial indices, and the PBSM algorithm. These comparisons are based on complete implementations of these algorithms in Paradise, a database system for handling GIS applications. Using real data sets, the performance study examines the behavior of these spatial join algorithms in a variety of situations, including the cases when both, one, or none of the inputs to the join have an suitable index. The study also examines the effect of clustering the join inputs on the performance of these join algorithms. The performance comparisons demonstrates the feasibility, and applicability of the PBSM join algorithm.","Computer Sciences Department, University of Wisconsin, Madison",,4
380,Maximal-Munch Tokenization in Linear Time,THOMAS REPS,"The lexical-analysis (or scanning) phase of a compiler attempts to partition the input stream into a sequence of tokens. The convention in most languages is that the input is scanned left to right, and each token identified is a maximal munch of the remaining inputthe longest prefix of the remaining input that is a token of the language. Most textbooks on compiling have extensive discussions of lexical analysis in terms of finite-state automata and regular expressions: Token classes are defined by a set of regular expressions R i , 1 i k, and the lexical analyzer is based on some form of finite-state automaton for recognizing the language L (R 1 + R 2 + . . . + R k ). However, the treatment is unsatisfactory in one respect: The theory of finite-state automata assumes that the end of the input stringi.e., the right-hand-side boundary of the candidate for recognitionis known a priori, whereas a scanner must identify the next token without knowing a definite bound on the extent of the token. Although most of the standard compiler textbooks discuss this issue, the solution they sketch out is one thatfor certain sets of token definitionscan cause the scanner to exhibit quadratic behavior in the worst case. This property is not only dissatisfying, it blemishes an otherwise elegant treatment of lexical analysis. In this paper, we rectify this defect: We show that, given a deterministic finite-state automaton that recognizes the tokens of a language, maximal-munch tokenization can always be performed in time linear in the size of the input.",University of Wisconsin,,5
381,Cost-Aware WWW Proxy Caching Algorithms,Pei Cao Sandy Irani,"Abstract Web caches can not only reduce network traffic and downloading latency, but can also affect the distribution of web traffic over the network through cost-aware caching. This paper introduces GreedyDual-Size, which incorporates locality with cost and size concerns in a simple and non-parameterized fashion for high performance. Trace-driven simulations show that with the appropriate cost definition, GreedyDual-Size outperforms existing web cache replacement algorithms in many aspects, including hit ratios, latency reduction and network cost reduction. In addition, GreedyDual-Size can potentially improve the performance of main-memory caching of Web documents.","Department of Computer Science, Information and Computer Science Department, University of Wisconsin-Madison. University of California-Irvine.",,4
382,High Performance Computing Division,Aart J.C. Bik,,Department of Computer Science Leiden University,"P.O. Box 9512, 2300 RA Leiden The Netherlands",4
383,Kerberos: An Authentication Service for Open Network Systems,Jennifer G. Steiner,"ABSTRACT In an open network computing environment, a workstation cannot be trusted to identify its users correctly to network services. Kerberos provides an alternative approach whereby a trusted third-party authentication service is used to verify users' identities. This paper gives an overview of the Kerberos authentication model as implemented for MIT's Project Athena. It describes the protocols used by clients, servers, and Kerberos to achieve authentication. It also describes the management and replication of the database required. The views of Kerberos as seen by the user, programmer, and administrator are described. Finally, the role of Kerberos in the larger Athena picture is given, along with a list of applications that presently use Kerberos for user authentication. We describe the addition of Kerberos authentication to the Sun Network File System as a case study for integrating Kerberos with an existing application.",Project Athena Massachusetts Institute of Technology,"Cambridge, MA 02139",4
384,Approximate Analysis of Parallel Processor Allocation Policies,Rajesh K. Mansharamani and Mary K. Vernon,"Abstract The complexity of parallel applications and parallel processor scheduling policies makes both exact analysis and simulation difficult, if not intractable, for large systems. In this paper we propose a new approach to performance modeling of multiprogrammed processor scheduling policies, that of interpolation approximations. We first define a workload model that contains parameters for the essential properties of parallel applications with respect to scheduling discipline performance, yet lends itself to mathematical analysis. Key features of the workload model include general distribution of total job processing time, general distribution of available job parallelism, and a simple characterization of parallelism overheads. We then show that one can find specific values of the system parameters for which the parallel system under a given scheduling policy reduces to a queueing system with a known (closed-form) solution. Finally, interpolation between the points with known solutions is used to arrive at mean response time estimates that hold over the entire system parameter space. The interpolation approximations readily yield insight into policy behavior and are easy to evaluate for systems with hundreds of processors. We illustrate the approach by developing and validating models of three scheduling policies, under the assumptions of linear job execution rates and independence between job parallelism and processing time. We discuss several insights and results obtained from the analysis of the three policies under the assumed workloads. One result clarifies and generalizes observations in two previous simulation studies of how policy performance varies with the coefficient of variation in job processing requirement. Another result of the interpolation models yields new insight into how policy performance varies with job parallelism. We also comment on the generalizations of these insights for workloads with less restrictive assumptions.",Computer Sciences Department University of Wisconsin,"1210 West Dayton Street Madison, WI 53706.",3
385,Use of Application Characteristics and Limited Preemption for Run-To-Completion Parallel Processor Scheduling Policies *,"Su-Hui Chiang , Rajesh K. Mansharamani , and Mary K. Vernon","Abstract The performance potential of run-to-completion (RTC) parallel processor scheduling policies is investigated by examining whether (1) application execution rate characteristics such as average parallelism (avg) and processor working set (pws) and/or (2) limited preemption can be used to improve the performance of these policies. We address the first question by comparing policies (previous as well as new) that differ only in whether or not they use execution rate characteristics and by examining a wider range of the workload parameter space than previous studies. We address the second question by comparing a simple two-level queueing policy with RTC scheduling in the second level queue against RTC policies that don't allow any preemption and against dynamic equiallocation (EQ). Using simulation to estimate mean response times we find that for promising RTC policies such as adaptive static partitioning (ASP) and shortest demand first (SDF), a maximum allocation constraint that is for all practical purposes independent of avg and pws provides greater and more consistent improvement in policy performance than using avg or pws. Also, under the assumption that job demand information is unavailable to the scheduler we show that the ASP-max policy outperforms all previous high performance RTC policies for workloads with coefficient of variation in processing requirement greater than one. Furthermore, a two-level queue that allows at most one preemption per job outperforms ASP-max but is not competitive with EQ.",Computer Sciences Department University of Wisconsin-Madison,"Madison, WI 53706.",1
386,Program Generalization for Software Reuse: From C to C++,Michael Siff,"Abstract We consider the problem of software generalization: Given a program component C, create a parameterized program component C 0 such that C 0 is usable in a wider variety of syntactic contexts than C. Furthermore, C 0 should be a semantically meaningful generalization of C; namely, there must exist an instantiation of C 0 that is equivalent in functionality to C. In this paper, we present an algorithm that generalizes C functions via type inference. The original functions operate on specific data types; the result of generalization is a collection of C++ function templates that operate on parameterized types. This version of the generalization problem is useful in the context of converting existing C programs to C++.",University of Wisconsin-Madison,"1210 West Dayton Street Madison, WI 53706",4
387,MULTI-COORDINATION METHODS FOR PARALLEL SOLUTION OF BLOCK-ANGULAR PROGRAMS,By Golbon Zakeri,,UNIVERSITY OF WISCONSIN - MADISON,,3
388,SYNCHRONOUS AND ASYNCHRONOUS MULTI-COORDINATION METHODS FOR THE SOLUTION OF BLOCK-ANGULAR PROGRAMS,R.R. MEYER AND G. ZAKERI,"Abstract. Several types of multi-coordination methods for block-angular programs are considered. We present a computational comparison of synchronous multi-coordination methods. The most efficient of these approaches is shown to involve an intermediate number of blocks in the coordination phase. We also develop a new stabilization algorithm and present asynchronous multi-coordination schemes, which are particularly useful when the number of blocks exceeds the number of available processors or when the block sizes vary significantly.",,,3
389,An Evaluation of Object Management System Architectures for Software Engineering Applications,"Jayavel Shanmugasundaram, Barbara Staudt Lerner, Lori Clarke","ABSTRACT Software engineering applications require sophisticated object management system support for creating and manipulating software objects. One of the key issues for object management systems is distribution. Addressing this issue in the context of software engineering applications is particularly challenging because they have widely varying object access profiles. Two fundamental approaches to dealing with distribution are the object server architecture, where objects are shipped to the application program, and the operation server architecture, where operation requests are shipped to where the objects reside. We compare these architectures experimentally to determine the conditions under which each performs better.",Department of Computer Science University of Massachusetts,"Amherst, MA 01003 USA",5
